"conversation_id_str","created_at","favorite_count","full_text","id_str","image_url","in_reply_to_screen_name","lang","location","quote_count","reply_count","retweet_count","tweet_url","user_id_str","username"
"1561603257885425664","Mon Aug 22 06:36:44 +0000 2022","0","Perang Rusia-Ukraina Mau 6 Bulan Dipastikan Gak Kelar-Kelar? https://t.co/Wowi8Y0RMW","1561603257885425664","","","in","","0","0","0","https://x.com/undefined/status/1561603257885425664","847372542830444544",
"1496905365354532868","Thu Feb 24 17:50:24 +0000 2022","337","TERKINI Ibu Pejabat Tentera US Pentagon mengeluarkan analisis Rusia-Ukraine ketika ini - 100 misil dilancarkan ke arah Ukraine setakat ini. Ia datang dari Belarus Rusia dan laut. Lapangan Terbang dan infrastruktur tentera menjadi sasaran. Nampak macam Rusia akan bergerak","1496905365354532868","","","in","","1","1","99","https://x.com/undefined/status/1496905365354532868","2194068895",
"1561152584542715904","Sun Aug 21 00:45:55 +0000 2022","3","Ajak Putin Bicara Erdogan Siap Damaikan Perang Rusia-Ukraina https://t.co/bMnMRqgIgl","1561152584542715904","","","in","","0","0","1","https://x.com/undefined/status/1561152584542715904","847372542830444544",
"1561491204784545792","Sun Aug 21 23:11:28 +0000 2022","3","Perang Minggir! Rusia-Ukraina Damai Mata-matai Negara NATO https://t.co/lpI3GA0hhb","1561491204784545792","","","in","","0","0","1","https://x.com/undefined/status/1561491204784545792","847372542830444544",
"1508789737514930177","Tue Mar 29 12:54:40 +0000 2022","197","TERKINI Ketua Rundingan Rusia merangkap Menteri Kebudayaan Rusia Vladimir Medinsky mengumumkan hasil rundingan dgn Ukraine di Istanbul Turki - Rusia tak halang Ukraine masuk EU - Ukraine tidak akan menakluk Crimea dan Donbass","1508789737514930177","","","in","","2","1","55","https://x.com/undefined/status/1508789737514930177","2194068895",
"1525877114750181376","Sun May 15 16:33:48 +0000 2022","255","Hampir 3 bulan setelah dimulainya operasi militer khusus Ukraina masih memenangkan perang informasi sementara Rusia terus memenangkan perang nyata dengan kemajuan harian baru meskipun hanya mengerahkan kurang dari 10% peralatannya dan jumlah pasukan yang sangat terbatas.","1525877114750181376","","","in","","0","13","27","https://x.com/undefined/status/1525877114750181376","1368870412851974146",
"1561857834823852034","Mon Aug 22 23:28:20 +0000 2022","1","Perang Rusia-Ukraina telah memakan banyak korban. Mengapa tidak dihentikan saja agar dunia bisa melanjutkan pembangunan mengatasi dampak perubahan iklim dan berbagai masalah global yang menuntut banyak penyesuaian. #Opini #AdadiKompas https://t.co/WX1C3FE97K","1561857834823852034","","","in","","0","0","1","https://x.com/undefined/status/1561857834823852034","255866913",
"1560917389642022912","Sat Aug 20 09:11:20 +0000 2022","0","Turkiye Siap Berkontribusi Akhiri Perang Rusia-Ukraina lewat Diplomasi https://t.co/BLyjDmFQTE","1560917389642022912","","","in","","0","0","0","https://x.com/undefined/status/1560917389642022912","948421189",
"1560921909755187204","Sat Aug 20 09:29:18 +0000 2022","16","Presiden RI ke-6 Susilo @SBYudhoyono menyinggung kondisi negara2 G20 yang terbelah akibat perang Rusia-Ukraina yang terjadi sejak Maret 2022. Hal itu diungkapkan saat berpidato di Universiti Kebangsaan Malaysia @ukm_my. https://t.co/W0FayQZRBb","1560921909755187204","","","in","","0","0","3","https://x.com/undefined/status/1560921909755187204","61465123",
"1558996163193253890","Mon Aug 15 01:57:04 +0000 2022","1","Paus Fransiskus Sorot Perang Rusia-Ukraina yang Memperparah Ancaman Kelaparan di Dunia https://t.co/3iQsNvqQyc","1558996163193253890","","","in","","0","0","0","https://x.com/undefined/status/1558996163193253890","58880688",
"1562106273826361345","Tue Aug 23 15:55:32 +0000 2022","2","6 Bulan Perang Rusia-Ukraina Warga Moskow Terbelah Jadi 2 Kubu https://t.co/W8dv252PsY","1562106273826361345","","","in","","0","0","0","https://x.com/undefined/status/1562106273826361345","58880688",
"1561857593873551360","Mon Aug 22 23:27:22 +0000 2022","0","Perang Rusia-Ukraina telah memakan banyak korban. Mengapa tidak dihentikan saja agar dunia bisa melanjutkan pembangunan mengatasi dampak perubahan iklim dan berbagai masalah global yang menuntut banyak penyesuaian. #Opini #AdadiKompas https://t.co/dxbzr3BbfC","1561857593873551360","","","in","","0","0","0","https://x.com/undefined/status/1561857593873551360","771030588",
"1560623377727258624","Fri Aug 19 13:43:02 +0000 2022","0","Presiden Turki Recep Tayyip Erdogan menyatakan Ankara siap membantu upaya mengakhiri perang Rusia-Ukraina melalui diplomasi #PerangRusia-Ukraina https://t.co/BV9IF14cPX","1560623377727258624","","","in","","0","0","0","https://x.com/undefined/status/1560623377727258624","79130206",
"1560380657305395200","Thu Aug 18 21:38:33 +0000 2022","0","Update perang Rusia vs Ukraina sebanyak 6 orang tewas di Kharkiv hingga pasukan Putin latihan bersama dengan pasukan China https://t.co/BEM0AeMOKN #beritaterkini #beritaterbaru #rusia #Ukraina","1560380657305395200","","","in","","0","0","0","https://x.com/undefined/status/1560380657305395200","103551225",
"1557552381327314944","Thu Aug 11 02:20:00 +0000 2022","0","Tujuan utama NATO pada perang Rusia-Ukraina dibeberkan langsung oleh Jens Stoltenberg https://t.co/747sqpKnx4","1557552381327314944","","","in","","0","0","0","https://x.com/undefined/status/1557552381327314944","944180887171743745",
"1556890861937782791","Tue Aug 09 06:31:21 +0000 2022","0","Menteri Pertanian Syahrul Yasin Limpo memprediksi harga mi instan bakal naik 3 kali lipat. Penyebabnya pasokan bahan utama pembuatan mi instan yaitu gandum tersendat akibat perang Ukraina-Rusia. #inibaruid https://t.co/pBURA2jHMk","1556890861937782791","","","in","","0","0","0","https://x.com/undefined/status/1556890861937782791","915242765453213696",
"1561720556277403653","Mon Aug 22 14:22:50 +0000 2022","0","Istri dari salah satu ajudan Vladimir Putin clubbing di negara anggota NATO yang menentang perang Rusia ke Ukraina. Wanita itu kini dikecam. https://t.co/c5F5epk9yZ","1561720556277403653","","","in","","0","0","0","https://x.com/undefined/status/1561720556277403653","95579729",
"1560799042661019648","Sat Aug 20 01:21:04 +0000 2022","0","AS Akan Terjun Langsung di Perang Ukraina Rusia? https://t.co/AbRRBHTWZG","1560799042661019648","","","in","","0","0","0","https://x.com/undefined/status/1560799042661019648","23786106",
"1561379591805173761","Sun Aug 21 15:47:58 +0000 2022","1","TURKI SIAP BERKONTRIBUSI UNTUK AKHIRI PERANG RUSIA-UKRAINA https://t.co/CnKluCqceh","1561379591805173761","","","in","","0","0","1","https://x.com/undefined/status/1561379591805173761","3826093393",
"1561871730523529216","Tue Aug 23 00:23:33 +0000 2022","1","Enam Bulan Perang Rusia Vs Ukraina: Segini Jumlah Korban Sipil Militer dan Anak-Anak https://t.co/DTYtuGjkPD","1561871730523529216","","","in","","0","0","0","https://x.com/undefined/status/1561871730523529216","118646322",
"1561896540293066752","Tue Aug 23 02:02:08 +0000 2022","1","6 Bulan Perang Rusia vs Ukraina: Rusia Cuan Rp2.000 Triliun Dunia Merana https://t.co/D23WThFjGd","1561896540293066752","","","in","","0","0","0","https://x.com/undefined/status/1561896540293066752","118646322",
"1561657223297650688","Mon Aug 22 10:11:10 +0000 2022","0","Rangkuman Perang Rusia vs Ukraina Hari ke-180: Ukraina Mulai Waspada! https://t.co/Kw7VcjM5xD","1561657223297650688","","","in","","0","0","0","https://x.com/undefined/status/1561657223297650688","118646322",
"1557422693796188161","Wed Aug 10 17:44:40 +0000 2022","0","Dampak Konflik China-Taiwan Terhadap Perekonomian Dunia Lebih Buruk dari Perang Rusia-Ukraina https://t.co/eCgVdzFmEo","1557422693796188161","","","in","","0","0","0","https://x.com/undefined/status/1557422693796188161","1012174601055449088",
"1560625262832001027","Fri Aug 19 13:50:32 +0000 2022","0","Erdogan Siap Bantu Akhiri Perang Rusia-Ukraina melalui Diplomasi https://t.co/Ib7QV3vLLG #Diplomasi #erdogan #rusia #ukraina","1560625262832001027","","","in","","0","0","0","https://x.com/undefined/status/1560625262832001027","89877164",
"1558635666782699523","Sun Aug 14 02:04:35 +0000 2022","0","ILUNI UIInternational Talks Situasi Pasca Perang Rusia-Ukraina dan Krisis Laut Natuna https://t.co/tHTyOyEUSF","1558635666782699523","","","in","","0","0","0","https://x.com/undefined/status/1558635666782699523","3647758879",
"1561933432053268480","Tue Aug 23 04:28:44 +0000 2022","0","Fakta mencengangkan terungkap di balik perang yang berkecamuk antara Rusia dan Ukraina. Ternyata negeri beruang merah itu meraup cuan besar! Kok bisa? https://t.co/OgwZ4jnG0N","1561933432053268480","","","in","","0","0","0","https://x.com/undefined/status/1561933432053268480","135795460",
"1560637742614163457","Fri Aug 19 14:40:07 +0000 2022","0","Erdogan: Turki Siap Bantu Akhiri Perang Rusia-Ukraina https://t.co/09SVt52qs8","1560637742614163457","","","in","","0","0","0","https://x.com/undefined/status/1560637742614163457","1554019722",
"1558635627784163329","Sun Aug 14 02:04:26 +0000 2022","0","ILUNI UIInternational Talks Situasi Pasca Perang Rusia-Ukraina dan Krisis Laut Natuna https://t.co/z34Os5xiDX","1558635627784163329","","","in","","0","0","0","https://x.com/undefined/status/1558635627784163329","4784369184",
"1560616528122224641","Fri Aug 19 13:15:49 +0000 2022","0","Saya kira dunia boleh berharap terhadap peran Erdogan Erdogan: Turki Siap Bantu Akhiri Perang Rusia-Ukraina https://t.co/OexAqnslPP Baca berita terkini dengan mudah dan nyaman download aplikasi Inilahcom di iOS dan Android #inilahcom #inilahdotcom lewat @inilahdotcom","1560616528122224641","","","in","","0","0","0","https://x.com/undefined/status/1560616528122224641","373930288",
"1561727433694334976","Mon Aug 22 14:50:10 +0000 2022","2","6 Bulan Perang Melawan Ukraina Rusia Disebut Untung Rp2.000 Triliun https://t.co/11vVH4CTJT","1561727433694334976","","","in","","0","0","0","https://x.com/undefined/status/1561727433694334976","155169715",
"1558090113225093121","Fri Aug 12 13:56:45 +0000 2022","0","#Jurnalis Wanita#Rusia#Perang Ukraina#Tahanan Rumah! Jurnalis wanita Rusia Marina Ovsyannikova yang melakukan protes invasi ke Ukraina di TV pada Maret 2022 jadi tahanan rumah mulai Kamis (11/8/2022) https://t.co/OGEIYbNAVR","1558090113225093121","","","in","","0","0","0","https://x.com/undefined/status/1558090113225093121","64635651",
"1561784174801027073","Mon Aug 22 18:35:38 +0000 2022","0","Terdampak Perang Rusia-Ukraina Harga Tepung Terigu di Sragen Meroket. Gorengan Siap-Siap Makin Mahal! https://t.co/6nvURrJDZZ","1561784174801027073","","","in","","0","0","0","https://x.com/undefined/status/1561784174801027073","949224511508955136",
"1558635568480780289","Sun Aug 14 02:04:12 +0000 2022","0","ILUNI UIInternational Talks Situasi Pasca Perang Rusia-Ukraina dan Krisis Laut Natuna https://t.co/qShY5FiiUZ","1558635568480780289","","","in","","0","0","0","https://x.com/undefined/status/1558635568480780289","1285016293",
"1558635680183554048","Sun Aug 14 02:04:38 +0000 2022","0","ILUNI UIInternational Talks Situasi Pasca Perang Rusia-Ukraina dan Krisis Laut Natuna https://t.co/WzX8lzf3YO","1558635680183554048","","","in","","0","0","0","https://x.com/undefined/status/1558635680183554048","223119150",
"1561710811021619200","Mon Aug 22 13:44:07 +0000 2022","0","Perang Rusia-Ukraina: Enam bulan yang mengguncang dunia https://t.co/cixrkJRIuZ","1561710811021619200","","","in","","0","0","1","https://x.com/undefined/status/1561710811021619200","1854261536",
